MCQ,Choices,Correct
Who coined the term machine learning in 1959?,a: Donald Hebb | b: Walter Pitts | c: Arthur Samuel | d: Warren McCulloch,c
What was the name of the experimental 'learning machine' developed by Raytheon Company in the early 1960s?,a: Cybernet | b: Cybertron | c: NeuralNet | d: DataLearn,b
"According to Tom M. Mitchell, what is the definition of machine learning algorithms?",a: Improving with experience E in tasks T and performance measure P | b: Classifying data based on models | c: Making predictions for future outcomes | d: Recognizing patterns using reinforcement learning,a
What was the focus of Nilsson's book on Learning Machines during the 1960s?,a: Machine learning for stock trading | b: Machine learning for pattern classification | c: Machine learning for computer vision | d: Machine learning for speech recognition,b
What is one of the objectives of modern-day machine learning?,a: To develop new computer programs | b: To make predictions for future outcomes | c: To study human cognitive processes | d: To analyze historical data,b
